{"claim_boundaries":["A promotion decision is not pack readiness, signing, staging, or activation.","A promotion decision is not curriculum completeness or learner mastery.","A promotion decision confers no grade, credit, licensing, or Ministry approval authority.","Reviewer appointments are not made by this config; unassigned slots block promote decisions.","Decisions bind only to the exact content and evidence digests they record; content edits invalidate promote eligibility."],"course":{"assessment_plan_path":"curriculum/courses/ontario-mth1w-2021.assessment-plan.json","course_code":"MTH1W","course_payload_path":"curriculum/courses/ontario-mth1w-2021.course.json"},"gate_id":"mth1w-promotion-gate","gate_version":"1","ledger":{"ledger_path":"curriculum/reviews/mth1w/promotion-ledger.json","ledger_schema":"axiom-education-mth1w-promotion-ledger.v1"},"promotion_decisions":["promote","hold","reject"],"quorum":{"all_required_review_types_approved":true,"min_distinct_reviewers":2},"required_confirmations":["expectation_binding_confirmed","content_correctness_confirmed","pedagogical_suitability_confirmed","age_appropriateness_confirmed"],"required_decision":"approved","required_review_types":["educator-instructional","cultural-context","accessibility","assessment-validity","licensing"],"reviewer_slots":[{"appointment_status":"unassigned","review_type":"educator-instructional","reviewer":null,"slot_id":"educator-instructional-reviewer"},{"appointment_status":"unassigned","review_type":"cultural-context","reviewer":null,"slot_id":"cultural-context-reviewer"},{"appointment_status":"unassigned","review_type":"accessibility","reviewer":null,"slot_id":"accessibility-reviewer"},{"appointment_status":"unassigned","review_type":"assessment-validity","reviewer":null,"slot_id":"assessment-validity-reviewer"},{"appointment_status":"unassigned","review_type":"licensing","reviewer":null,"slot_id":"licensing-reviewer"}],"schema":"axiom-education-mth1w-promotion-gate-config.v1","verification":{"review_evidence_dir":"curriculum/reviews/mth1w","verification_status":"lab-grade-not-production","verification_tool":"tools/mth1w_promotion_gate.py"}}